,ID,Status,Created At,Text,Polarity,Polarity Strength
274,1291003136677564417,tweet,2020-08-05 13:28:28,@HDFCBank_Cares @HDFC_Bank  Its more than 2 days.. No response from your side..  I want my money back.. How irresponsible and unprofessional behaviour from HDFC.. I want immediate action against such case.,1,0.15
275,1291003123423678464,tweet,2020-08-05 13:28:24,Amazon's Prime Day 2020 sale will begin at 12am (midnight) on August 6 and will be available until the end of August 7.[Available Exclusively for Prime Members]  https://t.co/e9R4JJKutL Wishlist Now👍  *Get 10% Instant Discount on HDFC Bank Debit/Credit Cards &amp; EMI* https://t.co/43E8BYrGEa,1,0.2
276,1291002713098997760,retweet,2020-08-05 13:26:47,@bhatiamanu 64k+...for me too sir...!!.. Yes good trending day courtsey reliance and Hdfc bank...!! https://t.co/yBQLzqbcCd,1,1.0
277,1291002407036452864,retweet,2020-08-05 13:25:34,"@HDFC_Bank Deposited in HDFC Bank SB Ac No. 50100203694165, Chowpatty Branch. No credit received. On approaching the Branch, I am told that no such record is with them. Global Reputed Bank? Third Grade Service. @RBI https://t.co/UJX28u5SZp",0,0.0
278,1291002319232856071,tweet,2020-08-05 13:25:13,So this is the reward i am receiving for a being a salaried account holder with you since 2017. @HDFC_Bank,0,0.0
279,1291002317077020672,tweet,2020-08-05 13:25:12,"My call was kept on hold for almost one hour to speak to the representative but at the end no one spoke to me , i had to disconnect the call after spending worthless one hour. @HDFC_Bank",-1,-0.8
280,1291002314816229376,tweet,2020-08-05 13:25:12,Worst service by HDFC bank and i am gonna post the review to reveal the truth of your filthy helpless services since 3-4 months.  I have been told to wait for my Credit Card status as it is not delivered to me inspite of updating the address.   @HDFC_Bank,-1,-0.9
281,1291002262089859074,retweet,2020-08-05 13:24:59,"RBI approves appointment of Sashidhar Jagdishan as HDFC Bank's new MD, CEO | #Law #Latest #LatestLaws #LegalNews #India #IndianNews #News #Legal  https://t.co/o5k4p5sqhj",1,0.2787878787878788
282,1291002143558664192,retweet,2020-08-05 13:24:31,@HDFCBank_Cares @HDFC_Bank please close my jumbo credit card account.i have written you many times but no action.9993936624 neelkamalgupta_9@msn.com,1,0.5
283,1291001371152375809,tweet,2020-08-05 13:21:27,A phone that has everything incredible in it now comes with an incredible benefit. Own the stunning Samsung Galaxy A71 with Rs. 2500 cashback when you buy it using SBI or HDFC Bank Credit Cards. Grab the offer before it’s gone. Only at #FoneCafeDeGoa . . #Smartphones #SamsungA71 https://t.co/ZNfcJ2qKBV,1,0.58
284,1291001096924565504,tweet,2020-08-05 13:20:21,"RBI approves appointment of Sashidhar Jagdishan as HDFC Bank's new MD, CEO | #Law #Latest #LatestLaws #LegalNews #India #IndianNews #News #Legal  https://t.co/o5k4p5sqhj",1,0.2787878787878788
285,1291000912744296449,tweet,2020-08-05 13:19:37,@TrakinTech @oppomobileindia No 10% Hdfc bank offer. Neither on Flipkart or Amazon,0,0.0
286,1291000679759097857,retweet,2020-08-05 13:18:42,Let us look at the comparison between ICICI Bank and HDFC Bank.  #stayinformed #stayinvested https://t.co/v6clWRVa4l,0,0.0
287,1291000495415283718,tweet,2020-08-05 13:17:58,"@FinMinIndia @RBI @HDFC_Bank this is the way rejecte everyone moratorium request except some housing loan and showing clear picture of lower moratorium that customers don't want moratorium,how customer will get,you need money immidiate n moratorium approval 30 day proces n reject",1,0.10000000000000002
288,1290999995525726208,tweet,2020-08-05 13:15:59,@rajcheerfull @HDFC_Bank Somebody following SOP blindly !,-1,-0.3125
289,1290999498907344896,tweet,2020-08-05 13:14:00,I am frustrated with HDFC BANK service. I have taken their QPOS MINI machine last year in the month of September. Executive who had installed it didn’t tell me about the low usage charges. Now bank is charging me low usage charge for the month of June. @HDFC_Bank @HDFCBank_Cares https://t.co/bHuboL13ET,-1,-0.175
290,1290999383186702341,tweet,2020-08-05 13:13:33,"@rathna_martina For queries related to HDFC Bank, please write to them at Grievance.Redressal@hdfcbank.com",0,0.0
291,1290999358792458243,tweet,2020-08-05 13:13:27,Dear @HDFCBank_Cares  @HDFC_Bank  whom to contact for personal loan enquiry &amp; status,0,0.0
292,1290999142022430720,tweet,2020-08-05 13:12:35,@nahar_bharath @BalakrishnanR @jaganmsna @KishoreVaid @dmuthuk @HDFCLIFE @HDFC_Bank @MoneylifeIndia It's a formula you can use in excel,0,0.0
293,1290998861503311873,tweet,2020-08-05 13:11:28,"@medleyrahul For queries related to HDFC Bank, please write to them at Grievance.Redressal@hdfcbank.com",0,0.0
294,1290998803734999040,retweet,2020-08-05 13:11:15,"@jaganmsna @KishoreVaid @datta_arvind @dmuthuk @HDFCLIFE @HDFC_Bank @MoneylifeIndia HDFC Bank enjoys a reputation that is not deserved. Integrity to customers has been a victim in every product. The focus on the bottom line is legendary. And of course, when you choose to invest, 'haraam' always gives greater returns than 'halaal'.",1,0.475
295,1290998582384955393,retweet,2020-08-05 13:10:22,Can create another middle-class in rural: HDFC Bank founder CEO Aditya Puri https://t.co/sSyOUZMXDx via @timesofindia,0,0.0
296,1290998581160218624,retweet,2020-08-05 13:10:21,"Are you a UX designer? Or do you know one?  Project: Pick up ANY Bank's (HDFC, Kotak) netbanking &amp; redesign it to solve for customer's pain. And release it publicly  #FinTech is HOT. It would be great project, will help you grow, will definitely get you a job if you want it",1,0.2625
297,1290998206319357952,tweet,2020-08-05 13:08:52,@HDFCBank_Cares @HDFC_Bank I have still not received a single reply. Please call me and resolve this issue team.,-1,-0.07142857142857142
298,1290998064832897024,retweet,2020-08-05 13:08:18,"@HDFC_Bank @DinersClub dear teams, I have been trying to get a hold of customer care for the past 2 days to simply pull out my credit card statements for the previous fiscal to file taxes. Even my priority representative is unable to help. The netbanking service is not working.",-1,-0.22916666666666666
299,1290997914404192258,retweet,2020-08-05 13:07:43,List of stocks for long term Investments  1. Sun Pharma 2. Lupin 3. HDFC bank 4. ITC 5. Pidilite  6.Asian Paint 7. Reliance  7.ADF Food 8. Finolex cables  9. Ambuja 10.Castrol  11.Vinati Organics 12.Aarti Ind 13.Rallis  14.PI Ind 15.HCL   #stocks #WealthCreation   @dmuthuk,-1,-0.05
300,1290997512430448640,tweet,2020-08-05 13:06:07,"@CeoNoida @TOIIndiaNews @noidapolice This person is collecting parking charges in front of Kotak,  Axis and HDFC bank at Sector 16 noida,  adjacent to Sec 16 metro station,  IS HE LEGAL AND AUTHORIZED.  Can anyone check.  You have to pay even you are going to withdraw from ATM. https://t.co/nrRt7fIqEF",1,0.05
301,1290997458852511746,retweet,2020-08-05 13:05:54,"Are you a UX designer? Or do you know one?  Project: Pick up ANY Bank's (HDFC, Kotak) netbanking &amp; redesign it to solve for customer's pain. And release it publicly  #FinTech is HOT. It would be great project, will help you grow, will definitely get you a job if you want it",1,0.2625
302,1290997023299182592,tweet,2020-08-05 13:04:10,"Are you a UX designer? Or do you know one?  Project: Pick up ANY Bank's (HDFC, Kotak) netbanking &amp; redesign it to solve for customer's pain. And release it publicly  #FinTech is HOT. It would be great project, will help you grow, will definitely get you a job if you want it",1,0.2625
303,1290996431809990656,tweet,2020-08-05 13:01:49,@datta_arvind @BalakrishnanR @jaganmsna @KishoreVaid @dmuthuk @HDFCLIFE @HDFC_Bank @MoneylifeIndia How do we calculate IRR?,0,0.0
304,1290995949850959874,tweet,2020-08-05 12:59:54,"@HDFC_Bank Poor, pathetic and worst services ever experienced in industry...Their motive are to cheat customers",-1,-0.4
305,1290995728664408064,retweet,2020-08-05 12:59:01,List of stocks for long term Investments  1. Sun Pharma 2. Lupin 3. HDFC bank 4. ITC 5. Pidilite  6.Asian Paint 7. Reliance  7.ADF Food 8. Finolex cables  9. Ambuja 10.Castrol  11.Vinati Organics 12.Aarti Ind 13.Rallis  14.PI Ind 15.HCL   #stocks #WealthCreation   @dmuthuk,-1,-0.05
306,1290995659022036995,tweet,2020-08-05 12:58:45,@HDFCBank_Cares shameful where youll show that an item purchased on EMI is a NO COST EMI product and then youll charge me an Interest on that EMI. ISNT THAT A SHAME @HDFC_Bank @HDFCCreditCard @HDFCBank_Cares @HDFCBankNews Never knew youll were such thieves. https://t.co/dhb2NtwAWl,0,0.0
307,1290995481276035073,tweet,2020-08-05 12:58:02,@HDFC_Bank Is your customer care really active ?. Why is HDFC bank performance going down nowadays ?. My amount is debited but not credit to destination. Tried all medium to reach HDFC but none is useful.,1,0.00370370370370369
308,1290995159908233216,tweet,2020-08-05 12:56:46,@HDFCBank_Cares @HDFC_Bank Still no response. Wonderful experience during a pandemic.,1,1.0
309,1290994763835953152,tweet,2020-08-05 12:55:11,@JstInvestments @AnishA_Moonka Should I invest in developing bank (IDFC First) or Developed bank (HDFC Bank)? Time Horizon: 5-7 Years,1,0.175
310,1290994373145047042,tweet,2020-08-05 12:53:38,"@BalakrishnanR @jaganmsna @KishoreVaid @datta_arvind @dmuthuk @HDFCLIFE @HDFC_Bank @MoneylifeIndia Very apt, they are working for stakeholders, not at all for customers. I m a customer too as I have business loan, they adopt as many ways to mint charges as possible.",1,0.4266666666666667
311,1290994315297079297,tweet,2020-08-05 12:53:24,@rajcheerfull @HDFC_Bank To save paper costs.,0,0.0
312,1290993760810090496,tweet,2020-08-05 12:51:12,@HDFCBank_Cares @HDFC_Bank  I am trying to call credit card costumer care since morning but not getting any response.  I need help as my card return without intimating me. Please assist me,0,0.0
313,1290993634628648963,retweet,2020-08-05 12:50:42,New CEO of HDFC Bank is CA Shashidhar Jagdishan. It’s Chartered Accountant at helm to charter bank through tough times. @theicai,-1,-0.12626262626262627
314,1290993525476081665,retweet,2020-08-05 12:50:16,List of stocks for long term Investments  1. Sun Pharma 2. Lupin 3. HDFC bank 4. ITC 5. Pidilite  6.Asian Paint 7. Reliance  7.ADF Food 8. Finolex cables  9. Ambuja 10.Castrol  11.Vinati Organics 12.Aarti Ind 13.Rallis  14.PI Ind 15.HCL   #stocks #WealthCreation   @dmuthuk,-1,-0.05
315,1290993234815021056,tweet,2020-08-05 12:49:07,Fail to understand why should a customer suffer if ATM says request timed out and deducted !I need my money asap as my Hdfc bank ATM card showed request timed out but my money got deducted without any money coming out of ATM which belongs  to SBI @HDFCBank_Cares,-1,-0.625
316,1290993140422172673,tweet,2020-08-05 12:48:44,@HDFC_Bank @HDFCBank_Cares  @HDFCBankNews disgusting online service and pathetic customer care service...,-1,-1.0
317,1290992978899607552,retweet,2020-08-05 12:48:06,"@jaganmsna @KishoreVaid @datta_arvind @dmuthuk @HDFCLIFE @HDFC_Bank @MoneylifeIndia HDFC Bank enjoys a reputation that is not deserved. Integrity to customers has been a victim in every product. The focus on the bottom line is legendary. And of course, when you choose to invest, 'haraam' always gives greater returns than 'halaal'.",1,0.475
318,1290992947698102272,tweet,2020-08-05 12:47:58,"Uncertainty at HDFC Bank ends, Sashidhar Jagdishan a hard task master &amp; investors’ choice:... - https://t.co/zFybr5uxNd https://t.co/b9QUROvRFv @GoogleNewsより",-1,-0.2916666666666667
319,1290992473280405511,tweet,2020-08-05 12:46:05,@HDFC_Bank @HDFCBank_Cares  HDFC mobile banking application not working on iPhone 7 verison 13.7.  Refer attached video and Kindly lookinto this matter asap. https://t.co/HjKuvjZnPl,1,0.6
320,1290992292753416192,retweet,2020-08-05 12:45:22,".@RBI approves appointment of Sashidhar Jagdishan as the new Managing Director &amp; #CEO of @HDFC_Bank. It will be effective from October 27, 2020, on the retirement of Aditya Puri. #LeadersAtHDFCBank https://t.co/03imolZWxT",1,0.36818181818181817
321,1290992227422896139,retweet,2020-08-05 12:45:07,@HDFC_Bank  My card number is 5241810000184283 and I am the harrassed customer of Hdfc Credit Card. I am using this cards from 8 years. Bank has taken late payment/finance charges of more than 1 lac rupees against dues of 2.2 lacs. They have charged interest at the rate of 39%,1,0.1
322,1290992055942934529,tweet,2020-08-05 12:44:26,@HDFC_Bank  My card number is 5241810000184283 and I am the harrassed customer of Hdfc Credit Card. I am using this cards from 8 years. Bank has taken late payment/finance charges of more than 1 lac rupees against dues of 2.2 lacs. They have charged interest at the rate of 39%,1,0.1
323,1290991233997791232,tweet,2020-08-05 12:41:10,@HDFC_Bank  should I wait for one month or more to activate my transfer rights in #Netbanking? Should I visit multiple times in your branch? I am not getting transfer rights from last 15 days. is this your service? #Timewaster.,1,0.16666666666666666
324,1290991051704950785,tweet,2020-08-05 12:40:26,"Hey, @HDFC_Bank I am trying to talk to your customer service. Finally, I became sick because the call is not connecting. If you see this message, plz reply back. Need your urgent service.",-1,-0.2380952380952381
325,1290991023250796545,retweet,2020-08-05 12:40:20,SELF BEFORE SERVICE TYPE.. HIS SELLING OF SHARES SHAKES CUSTOMER CONFIDENCE..@HDFC_Bank https://t.co/QBtlDqORYR,0,0.0
326,1290990974454214663,tweet,2020-08-05 12:40:08,Let us look at the comparison between ICICI Bank and HDFC Bank.  #stayinformed #stayinvested https://t.co/v6clWRVa4l,0,0.0
327,1290990833697611776,tweet,2020-08-05 12:39:34,@BalakrishnanR @jaganmsna @KishoreVaid @dmuthuk @HDFCLIFE @HDFC_Bank @MoneylifeIndia When staff has stiff targets there is bound to be mis-selling by all and sundry. My RM has tried selling me an insurance policy numerable times but when I calculate IRR &amp; show it to him that there is a big difference between return he shows me &amp; what actual is then he backs off,-1,-0.07142857142857142
328,1290990474593886210,tweet,2020-08-05 12:38:09,"Top Nifty gainers include names like Adani Ports, Eicher Motors, Tata Steel, and Hindalco Industries.  Top Nifty losers include names like Power Grid, HDFC Life, HDFC Bank, and UPL.",1,0.26666666666666666
329,1290990219789873157,retweet,2020-08-05 12:37:08,Haven’t understood @HDFC_Bank ! You have my KYC and details of my PAN and Aadhar. So why do you still insist on a xerox of it for every transaction?,0,0.0
330,1290990173837303819,retweet,2020-08-05 12:36:57,SELF BEFORE SERVICE TYPE.. HIS SELLING OF SHARES SHAKES CUSTOMER CONFIDENCE..@HDFC_Bank https://t.co/QBtlDqORYR,0,0.0
331,1290990098440310785,tweet,2020-08-05 12:36:39,RBI Approves Sashidhar Jagdishan as Next CEO of HDFC Bank | The National TV 𝗙𝘂𝗹𝗹 𝗡𝗲𝘄𝘀: https://t.co/bgAXKPVEih . . . #RBI #ReserveBankOfIndia #HDFCBank #SashidharJagdishan #CEO #newsfeed #dailynews #thenationaltv https://t.co/3NV1Ldj4rn,0,0.0
332,1290989893745700865,tweet,2020-08-05 12:35:50,@HDFC_Bank i will never believe being abused by hdfc bank agents and being harassed by people visiting my doorstep for a card that i never asked for. Shame on you hdfc. You don’t even train your employees to talk to people who trust your bank for years. #harassment  #hdfcbank,0,0.0
333,1290989209524690947,tweet,2020-08-05 12:33:07,"Sensex, Nifty Off Day's Highs; HDFC Bank, Infosys Among Top Drags https://t.co/9rWwVPoyX5 #business #Economy #IMF #World #Market #StockMarket #stockstowatch #TrendingNews #Investing #PROBAY",1,0.5
334,1290989206097948672,tweet,2020-08-05 12:33:06,"Dear all, It is in new that chairman of HDFC bank is against moratorium extension as if bank is not charging interest with us. In this pandemic almost every middle class lost job or business and bank is not funding them as as per RBI then who is benefited 20laks crores. Pls share",1,0.06818181818181818
335,1290989048224313346,retweet,2020-08-05 12:32:29,"Almost 2 months, and this case is not yet closed. Still struggling to get my EMI pre-colsure request entertained. Pathetic sevices Pathetic bank @HDFC_Bank @HDFCBank_Cares @HDFCLIFE @hdfcsec.......  @RBI Pls suggest what action can be taken on this ? https://t.co/KOLcbFNG7r",-1,-0.5
336,1290989022689529857,retweet,2020-08-05 12:32:23,List of stocks for long term Investments  1. Sun Pharma 2. Lupin 3. HDFC bank 4. ITC 5. Pidilite  6.Asian Paint 7. Reliance  7.ADF Food 8. Finolex cables  9. Ambuja 10.Castrol  11.Vinati Organics 12.Aarti Ind 13.Rallis  14.PI Ind 15.HCL   #stocks #WealthCreation   @dmuthuk,-1,-0.05
337,1290988887142105088,retweet,2020-08-05 12:31:50,"@HDFC_Bank Deposited in HDFC Bank SB Ac No. 50100203694165, Chowpatty Branch. No credit received. On approaching the Branch, I am told that no such record is with them. Global Reputed Bank? Third Grade Service. @RBI https://t.co/UJX28u5SZp",0,0.0
338,1290988712914903042,tweet,2020-08-05 12:31:09,"@HDFCBank_Cares @HDFC_Bank Don't u think its too early to reply after almost a month, u should have replied next year",1,0.05
339,1290988705528737792,tweet,2020-08-05 12:31:07,"@itsprasadhp @AnyBodyCanFly @nishkumar1977 Have sufficient mediclaim and personal accident policy. Take term insurance plan. Invest regularly in public provident fund. Do not go for credit cards. Study  stocks like Reliance,HDFC bank,Kotak Mahindra Bank,Asian Paints,Pidilite,Titan,Bata etc.Whenever market collapse buy .",0,0.0
340,1290988686247710720,tweet,2020-08-05 12:31:02,"@goodashay Hi, we note that you wish to close your credit card. In the rare event if you are still contemplating card discontinuance, we request you to forward us a duly signed letter to the following address to enable us do the needful. HDFC Bank Cards Division, PO BOX # 8654, (1/2)",1,0.15
341,1290988624448638977,tweet,2020-08-05 12:30:48,"@HDFC_Bank Deposited in HDFC Bank SB Ac No. 50100203694165, Chowpatty Branch. No credit received. On approaching the Branch, I am told that no such record is with them. Global Reputed Bank? Third Grade Service. @RBI https://t.co/UJX28u5SZp",0,0.0
342,1290988433129709568,retweet,2020-08-05 12:30:02,"Meet CA Sashidhar Jagdishan  Joined as Manager (Finance) in HDFC in 1996, become CFO in 2008, now he will be successor of Mr Aditya Puri to hold the position of CEO at HDFC bank.  Beside being CA, he also holds graduation in physics and master’s degree in economics. https://t.co/qAzbEesdYg",0,0.0
343,1290988346471092224,tweet,2020-08-05 12:29:41,"Amazon Prime Day Sale! 6th - 7th August upto 70% off, get 10% instant discount on HDFC Bank Debit/Credit Cards.  Shop Here: https://t.co/K4zL28VH7p https://t.co/pkO7ultw7L",0,0.0
344,1290988302535757824,tweet,2020-08-05 12:29:31,@dmuthuk called HDFC Bank for some work on my credit card... they told that I have a free offer that provides many benefits like life &amp; disability cover at very 'nominal' rates... surprised to know that the 'offer' was in collaboration with Max Bupa and not HDFC Life...,1,0.30000000000000004
345,1290988247124815873,tweet,2020-08-05 12:29:18,"Sensex falls 477 points from day's high on profit booking, ends 25 points lower; all eyes on RBI policy out... https://t.co/8iIfRYiwRw #business #Economy #IMF #World #Market #StockMarket #stockstowatch #TrendingNews #Investing #PROBAY",1,0.16
346,1290987915640623106,tweet,2020-08-05 12:27:59,"@HDFCBank_Cares My account balance is -28,263.10 and it is showing held by HDFC bank MIREVENUE HOLD THROUGH GEFU. I have called multiple times to the customer care and had to wait for 55 mins just for the call to get disconnected. Worst experience ever #hdfcbank",-1,-0.5
347,1290987818974511106,retweet,2020-08-05 12:27:36,"Meet CA Sashidhar Jagdishan  Joined as Manager (Finance) in HDFC in 1996, become CFO in 2008, now he will be successor of Mr Aditya Puri to hold the position of CEO at HDFC bank.  Beside being CA, he also holds graduation in physics and master’s degree in economics. https://t.co/qAzbEesdYg",0,0.0
348,1290987815845744642,tweet,2020-08-05 12:27:35,Filling big shoes. A tale from India. https://t.co/4kYl9gOjTg,0,0.0
349,1290987809839308802,tweet,2020-08-05 12:27:33,SELF BEFORE SERVICE TYPE.. HIS SELLING OF SHARES SHAKES CUSTOMER CONFIDENCE..@HDFC_Bank https://t.co/QBtlDqORYR,0,0.0
350,1290987512144384005,tweet,2020-08-05 12:26:22,"@HDFC_Bank @HDFCBank_Cares  the insta loan was credited without my approval, when i want to close the same, the bank and the CC team is not responding, worst service",-1,-0.5
351,1290986909989310465,tweet,2020-08-05 12:23:59,"@loginrsanthosh Hi, we note that you wish to close your credit card. In the rare event if you are still contemplating card discontinuance, we request you to forward us a duly signed letter to the following address to enable us do the needful. HDFC Bank Cards Division, PO BOX # 8654, (1/2)",1,0.15
352,1290986908340936706,tweet,2020-08-05 12:23:58,"@loginrsanthosh Hi, we note that you wish to close your credit card. In the rare event if you are still contemplating card discontinuance, we request you to forward us a duly signed letter to the following address to enable us do the needful. HDFC Bank Cards Division, PO BOX # 8654, (1/2)",1,0.15
353,1290986906625474560,tweet,2020-08-05 12:23:58,"@loginrsanthosh Hi, we note that you wish to close your credit card. In the rare event if you are still contemplating card discontinuance, we request you to forward us a duly signed letter to the following address to enable us do the needful. HDFC Bank Cards Division, PO BOX # 8654, (1/2)",1,0.15
354,1290986904796635138,tweet,2020-08-05 12:23:58,"@loginrsanthosh Hi, we note that you wish to close your credit card. In the rare event if you are still contemplating card discontinuance, we request you to forward us a duly signed letter to the following address to enable us do the needful. HDFC Bank Cards Division, PO BOX # 8654, (1/2)",1,0.15
355,1290986902951256066,tweet,2020-08-05 12:23:57,"@loginrsanthosh Hi, we note that you wish to close your credit card. In the rare event if you are still contemplating card discontinuance, we request you to forward us a duly signed letter to the following address to enable us do the needful. HDFC Bank Cards Division, PO BOX # 8654, (1/2)",1,0.15
356,1290986044033134594,tweet,2020-08-05 12:20:32,"@HDFC_Bank Hello, I am supposed to receive new debit card, however I am only receiving messages about the debit card and OTPs. Now the issue is I am not able to widraw the money from ATM as my old card got expired. Please suggest",-1,-0.0034090909090909107
357,1290985944657485824,retweet,2020-08-05 12:20:09,@HDFC_Bank what kind of people work under your aegis ?.......a women abuser ? A hatemonger ? ...... Takecare of this issue otherwise it will be escalated .... He is deriding and dephiling hindu gods and religion..... Plus is this the way you prescribe to talk to a female ? https://t.co/UYjWjl3lah,1,0.3
358,1290985882271408131,tweet,2020-08-05 12:19:54,"@satishemailbox @HDFC_Bank They r the worst when it comes 2 customer service.They r interested only in handing over the card.Once done, they shall desert u..Worst experience, or else who in this era of digitalization shall want u 2 go 2 their branch 4 change of email id or hotlisting of their useless cards",-1,-0.3125
359,1290985654214627329,tweet,2020-08-05 12:18:59,"Sensex falls 477 points from day's high on profit booking, ends 25 points lower; all eyes on RBI policy outcome  https://t.co/lR1VqbSMof",1,0.16
360,1290985647625232385,retweet,2020-08-05 12:18:58,1/n Succession at HDFC Bank: https://t.co/uERgniuiC9,0,0.0
361,1290985360533536769,tweet,2020-08-05 12:17:49,"@HDFC_Bank @HDFCBank_Cares @HDFCLIFE @HomeLoansByHDFC worst service experienced with @HomeLoansByHDFC i have been trying reaching out to customer care but not even a single time connected to hdfc also tried thier miss call number but none of the time recieved call back, worst ser",-1,-0.2542857142857143
362,1290985229188870144,tweet,2020-08-05 12:17:18,"4/n In the 1st quarter of lockdown about 9 percent of loans given out by HDFC Bank were under moratorium. If a part of these loans turn into bad assets, they will be reflected in the December quarter which will be Mr. Jagdishan's 1st quarter as in charge.",-1,-0.6999999999999998
363,1290985223602102272,tweet,2020-08-05 12:17:17,"2/n Mr. Aditya Puri did a stellar job of leading HDFC Bank for more than 25 years. Under his leadership, HDFC's assets grew from a mere Rs.3000 Crore to Rs.15 lakh Crore today and became the biggest private bank in the country.",1,0.0625
364,1290985219596513281,tweet,2020-08-05 12:17:16,1/n Succession at HDFC Bank: https://t.co/uERgniuiC9,0,0.0
365,1290985077300768768,tweet,2020-08-05 12:16:42,RBI Approved Sashidhar Jagdishan as Next MD &amp; CEO of HDFC Bank: He will succeed Aditya Puri… https://t.co/e4fHwAiHxI,0,0.0
366,1290984334623567874,tweet,2020-08-05 12:13:45,"@disIspiyush @HDFC_Bank They r the worst when it comes 2 customer service.They r interested only in handing over the card.Once done, they shall desert u..Worst experience, or else who in this era of digitalization shall want u 2 go 2 their branch 4 change of email id or hotlisting of their useless cards",-1,-0.3125
367,1290984316130881536,tweet,2020-08-05 12:13:40,"Harassment by @HDFCBank_Cares @HDFC_Bank @CarebyHDFC_HL  when I had opened an account earlier in March, I also got a credit card. A lady called me and asked if I wanted insurance and I said I needed time to decide. She said that I had to let her know now",0,0.0
368,1290984008353030144,tweet,2020-08-05 12:12:27,@rajcheerfull Their processes suck! @HDFCBank_Cares @HDFC_Bank  Never a solution for anything. Only problems.,0,0.0
