,ID,Status,Created At,Text,Polarity,Polarity Strength
0,1291067232668196864,tweet,2020-08-05 17:43:09,For #longterm #Investment  buy #LT (#Larsen and #toubro ) at 925 with Stoploss- 875 https://t.co/ITStXr1Q1f,0,0.0
1,1291062094859603968,tweet,2020-08-05 17:22:44,"SES PA Report - Larsen &amp; Toubro, AGM 13-08-2020. For more details https://t.co/wpBjVzqdB6 https://t.co/iWBW0Yv360",1,0.5
2,1291042482298540042,tweet,2020-08-05 16:04:48,"Blackrock: Larry Fink, your Fund is one of the largest shareholders in a Company that risks drowning Mumbai.  Vale is case study of a company that murdered a township. Larsen&amp;Toubro is the main contractor for a portion of the Coastal Road. Walk Your Talk! @blackrock @fayedsouza",1,0.2083333333333333
3,1291026752349724673,tweet,2020-08-05 15:02:18,@larissafernand @thamizhendiranc 1. Larsen and Toubro 1938 2. Amrutanjan health care 1893 3. G D Pharma 1929,0,0.0
4,1291010153949536256,tweet,2020-08-05 13:56:21,Larsen &amp; Toubro Limited appoints Avant-Garde for providing Design and Detailed Engineering Services for Flue Gas Ducting of Flue Gas Desulphurisation (FGD) system of 2x500MW DVC Mejia project #AvantGarde #AvantGardeIndia #FGD #Design #Detailed #Engineering #L&amp;T #DVC #Mejia https://t.co/e3UzDbWFdt,1,0.2428571428571429
5,1290962079805870080,tweet,2020-08-05 10:45:19,#LTI #Analysts/Institutional Investor Meet/Con. Call Updates Larsen &amp; Toubro Infotech Limited has informed the Exchange about Analysts/Institutional Investor Meet/Con. https://t.co/T4iFkT34mM,-1,-0.07142857142857142
6,1290940328170541057,tweet,2020-08-05 09:18:53,I had always told you all this  Today Larsen and Toubro infotech ltd crosses Rs 2500. Rs 2507.  Face value Rs 1.  All FAB 4 doing spectaculary well.  Last 2 months.,0,0.0
7,1290919130460110848,tweet,2020-08-05 07:54:39,@ImtiazMadmood Construction work awarded to Larsen &amp; Toubro.  Be assured it will be completed before 2024 elections.,0,0.0
8,1290912441547681793,retweet,2020-08-05 07:28:04,The much-awaited grand #RamMandir in Ayodhya will be constructed by construction giant Larsen and Toubro (L&amp;T). Who else!!!. After the resounding success of #StatueOfUnity #RamMandir4Bharat will be another feather in cap of L&amp;T.,1,0.26666666666666666
9,1290872709748908032,tweet,2020-08-05 04:50:11,"#LT #Larsen &amp; #Toubro   Breakout setup  Buy some below 935 and hold Stop loss : 900 Target : 980 , 1020 , 1060 , 1150  #JaiShriRam #RamMandir #Lebanon #COVIDー19 #stocks #stockstowatch #trading #BTC #investing #forex #forextrading #gold #nifty50 #money #motivation #Motivational https://t.co/tcuI8tMc5Q",0,0.0
10,1290871763056734209,tweet,2020-08-05 04:46:26,The much-awaited grand #RamMandir in Ayodhya will be constructed by construction giant Larsen and Toubro (L&amp;T). Who else!!!. After the resounding success of #StatueOfUnity #RamMandir4Bharat will be another feather in cap of L&amp;T.,1,0.26666666666666666
11,1290850691305496576,tweet,2020-08-05 03:22:42,#AyodhyaRamMandir  contract for construction may also go to Larsen &amp; Toubro? Afterall all landmark projects of Mr Modi are build by them irrespective of it's problems Any item to be imported from China?   #Observation,0,0.0
12,1290833345622900738,tweet,2020-08-05 02:13:46,Dividends Today 05/08/2020  Bharti Infratel Ltd Granules India Ltd Larsen &amp; Toubro Ltd Voltas Ltd  https://t.co/1FpTzzdkcO 9003634565,0,0.0
13,1290760565556572160,retweet,2020-08-04 21:24:34,"Larsen &amp; Toubro (L&amp;T), and parent firm of @LTI_Global had offered to build the Ram Mandir in Ayodhya over ruins of demolished #BabriMasjid for free.  With the upcoming ground breaking ceremony, L&amp;T is also set to be enabler of a fasc!st ideology.   https://t.co/r9Fb5wgxY3",1,0.01666666666666668
14,1290713267703287809,retweet,2020-08-04 18:16:37,Note to Middle East developers and contractors - remember the name *Larsen and Toubro*  the builders of the mandir in ayodhya. Just like they had a choice so do you.,0,0.0
15,1290696075058147328,retweet,2020-08-04 17:08:18,"Larsen &amp; Toubro (L&amp;T), and parent firm of @LTI_Global had offered to build the Ram Mandir in Ayodhya over ruins of demolished #BabriMasjid for free.  With the upcoming ground breaking ceremony, L&amp;T is also set to be enabler of a fasc!st ideology.   https://t.co/r9Fb5wgxY3",1,0.01666666666666668
16,1290692426076569606,retweet,2020-08-04 16:53:48,"Thank you L&amp;T for partnering with @MicrosoftIndia &amp; @MicrosoftTeams in the DT journey. MS Teams creates an all-in-one virtual collaborative workspace fostering a culture of caring, trust, continuous learning &amp; enables employees 2 work securely frm anywhere https://t.co/5X20SzQe4x",1,0.4
17,1290688958205030401,retweet,2020-08-04 16:40:02,"Thank you L&amp;T for partnering with @MicrosoftIndia &amp; @MicrosoftTeams in the DT journey. MS Teams creates an all-in-one virtual collaborative workspace fostering a culture of caring, trust, continuous learning &amp; enables employees 2 work securely frm anywhere https://t.co/5X20SzQe4x",1,0.4
18,1290687951001628674,tweet,2020-08-04 16:36:01,"Thank you L&amp;T for partnering with @MicrosoftIndia &amp; @MicrosoftTeams in the DT journey. MS Teams creates an all-in-one virtual collaborative workspace fostering a culture of caring, trust, continuous learning &amp; enables employees 2 work securely frm anywhere https://t.co/5X20SzQe4x",1,0.4
19,1290677472892080128,tweet,2020-08-04 15:54:23,Note to Middle East developers and contractors - remember the name *Larsen and Toubro*  the builders of the mandir in ayodhya. Just like they had a choice so do you.,0,0.0
20,1290605293487845378,tweet,2020-08-04 11:07:34,L&amp;T Technology services expand collaboration with Microsoft to offer eco-friendly solutions @LnTTechservices #Larsen&amp;Toubro #DrKeshabPandaL&amp;TTechnology  @Microsoft  @Office  @Microsoft  @Windows @MSFTnews  https://t.co/1Xok0VdQ8c https://t.co/OBKRFGFY7p,0,0.0
21,1290593041976360960,retweet,2020-08-04 10:18:53,"Larsen &amp; Toubro (L&amp;T), and parent firm of @LTI_Global had offered to build the Ram Mandir in Ayodhya over ruins of demolished #BabriMasjid for free.  With the upcoming ground breaking ceremony, L&amp;T is also set to be enabler of a fasc!st ideology.   https://t.co/r9Fb5wgxY3",1,0.01666666666666668
22,1290568511593631744,tweet,2020-08-04 08:41:25,@livefist @bsdhanoa Army to consider the light tank that is offered by DRDO an larsen and toubro,1,0.4
23,1290543842186289155,tweet,2020-08-04 07:03:23,@WhoShotMyCow The only LT I know is Larsen and Toubro lol they gave me a wallet as a gift once 😂,1,0.4
24,1290541362790580224,retweet,2020-08-04 06:53:32,"Today's highlights | 3 Aug 2020  • Sensex -1.77%, Nifty -1.64%  Top gainers: Titan, Tata Steel, SBI, Larsen &amp; Toubro Top losers: Kotak Mahindra Bank, IndusInd Bank, Axis Bank, ONGC  📨Read in-depth in your email inbox.",1,0.26666666666666666
25,1290534534203629569,tweet,2020-08-04 06:26:24,"@bsdhanoa In my opinion the Larsen and toubro light tank will be a better option still. BMP is outdated, they badly needs to be replaced. Larsen and toubro will be able to put out 20 tanks per month if they run in full capacity. But the order should be there.",1,0.10833333333333336
26,1290521626136547328,retweet,2020-08-04 05:35:07,"It's a privilege to hear @PatilJD1, Whole Time Director &amp; Senior EVP (Defence &amp; Smart Technologies), Larsen &amp; Toubro as he highlights various #digital and #SmartCity solutions built by them, for #SmartCities across India  #TheWorldAfter #SustainableUrbanFuture  @ET_Government https://t.co/oZs8I1izzd",1,0.10357142857142856
27,1290521398465634304,retweet,2020-08-04 05:34:12,"It's a privilege to hear @PatilJD1, Whole Time Director &amp; Senior EVP (Defence &amp; Smart Technologies), Larsen &amp; Toubro as he highlights various #digital and #SmartCity solutions built by them, for #SmartCities across India  #TheWorldAfter #SustainableUrbanFuture  @ET_Government https://t.co/oZs8I1izzd",1,0.10357142857142856
28,1290521349212057600,tweet,2020-08-04 05:34:01,"It's a privilege to hear @PatilJD1, Whole Time Director &amp; Senior EVP (Defence &amp; Smart Technologies), Larsen &amp; Toubro as he highlights various #digital and #SmartCity solutions built by them, for #SmartCities across India  #TheWorldAfter #SustainableUrbanFuture  @ET_Government https://t.co/oZs8I1izzd",1,0.10357142857142856
29,1290502545710825477,tweet,2020-08-04 04:19:17,@ovshake42 His dad worked in Larsen and Toubro - I heard a story that selectors at that time had asked him money and when his dad could not he was replaced by Ajit Agarkar .. not sure how much of this is true but heard this 20 years back so has to be some truth in it,1,0.075
30,1290450316580794369,tweet,2020-08-04 00:51:45,Vastu Hsng Fin to raise `10cr via 3yr bond  CPs HPCL to raise funds via intra-month CP at 3.40% coupon Larsen &amp; Toubro to raise funds via three-month CP at 3.38% coupon HDFC to raise funds via three-month CP at 3.46% coupon,0,0.0
31,1290375007114113024,tweet,2020-08-03 19:52:30,SURVEYOR­  TRANSMISSION LINE wanted at Larsen &amp; Toubro https://t.co/ydLUs6GrQG,0,0.0
32,1290370342909669376,tweet,2020-08-03 19:33:58,OVERHEAD ERECTION &amp; STRINGING TECHNICIAN (x100 positions)  - Larsen &amp; Toubro https://t.co/2mUa9r3VRS,0,0.0
33,1290340288389459968,tweet,2020-08-03 17:34:32,"Today's highlights | 3 Aug 2020  • Sensex -1.77%, Nifty -1.64%  Top gainers: Titan, Tata Steel, SBI, Larsen &amp; Toubro Top losers: Kotak Mahindra Bank, IndusInd Bank, Axis Bank, ONGC  📨Read in-depth in your email inbox.",1,0.26666666666666666
34,1290234553886359552,retweet,2020-08-03 10:34:23,"Larsen &amp; Toubro (L&amp;T), and parent firm of @LTI_Global had offered to build the Ram Mandir in Ayodhya over ruins of demolished #BabriMasjid for free.  With the upcoming ground breaking ceremony, L&amp;T is also set to be enabler of a fasc!st ideology.   https://t.co/r9Fb5wgxY3",1,0.01666666666666668
35,1290164009035939840,tweet,2020-08-03 05:54:04,Larsen and Toubro info at fresh 52Wk-H in today's session. Stock up 3%*,1,0.3
36,1290004610703220737,tweet,2020-08-02 19:20:40,"@SonuSood  sir you talk to ISRO Sivan, Sir &amp;big engineer how divert floods water Please   every year  floods in assam  Bihar uttarakhand   no permanent solution, why not bring interlink river project   Assam Save Animals, Larsen &amp;toubro big industry consult government",0,0.0
37,1289908823336128514,tweet,2020-08-02 13:00:03,"Join PTC and LTI - Larsen &amp; Toubro Infotech on Wednesday, August 26 at 2:30PM when they present on the topic of: Digital Manufacturing at Scale - Real Examples of Accelerating Digital Transformation Through Connected Operations. https://t.co/KkEDxkUQVj",1,0.05
38,1289876206104399872,tweet,2020-08-02 10:50:26,@anandchokshi19 You can add Larsen &amp; Toubro,0,0.0
39,1289857186974187522,retweet,2020-08-02 09:34:52,Stage is set at #Bangalore Metro's Cantonment Station for launching Phase 2's tunneling works!  Karnataka's CM @BSYBJP will likely be there to witness Larsen &amp; Toubro's TBM Urja build temporary rings within the station.   #Soon https://t.co/YUmXxSu9RJ https://t.co/hvibCvQLXj,0,0.0
40,1289823253263867904,tweet,2020-08-02 07:20:01,"Building to last for 1000 years - Ram Mandir at Ayodha, India Designed by Sompura Architects Construction by Larsen &amp; Toubro  Designed by  https://t.co/pS25HkZU0e  https://t.co/suEsWIGPMp. https://t.co/ELoLdm59wi",0,0.0
41,1289614755888369664,tweet,2020-08-01 17:31:32,"Trade idea: LARSEN AND TOUBRO LIMITED GDS (REPR 1 ORD INR2)(REG'S'): Just look , follow and enjoy Trade and make a profit https://t.co/MPvuv1Zf4r https://t.co/1aJ2bqPYz7",1,0.1642857142857143
42,1289614002016854019,retweet,2020-08-01 17:28:32,LARSEN AND TOUBRO LIMITED GDS (REPR 1 ORD INR2)(REG'S') https://t.co/DdESA5dLhN 🙋 via ⟶ https://t.co/QkR5LYqq2H https://t.co/M2m8Xvo2NV,-1,-0.07142857142857142
43,1289613896395808768,tweet,2020-08-01 17:28:07,LARSEN AND TOUBRO LIMITED GDS (REPR 1 ORD INR2)(REG'S') https://t.co/DdESA5dLhN 🙋 via ⟶ https://t.co/QkR5LYqq2H https://t.co/M2m8Xvo2NV,-1,-0.07142857142857142
44,1289578426521837569,tweet,2020-08-01 15:07:10,"Apex Home Healthcare Charlene Harrod-Owuamana LinkedIn Lowe's Companies, Inc. Wells Fargo Honeywell Merrill Lynch Southwest Airlines Larsen &amp; Toubro Unilever Gail Jernigan Rick Gow, CSA @Manleyenoch Leslie-Anne Weaver, RN, BSN, CCM Construction Week Kier…https://t.co/s3UBoCB0tX",0,0.0
45,1289561785670832128,tweet,2020-08-01 14:01:03,"@CMMadhyaPradesh @ChouhanShivraj I AM FROM INDORE MY NAME IS HETAL MEHTA, SIR I AM SUPPLIER IN LARSEN AND TOUBRO COMPANY. SIR I NEED A BUSINESS LOAN BUT BANKS ARE TELLING THAT WE CAN'T GIVE THE LOAN BECAUSE I HAVE START MY BUSINESS IN MONTH OF APRIL 2019.IF WILL NOT GET THE LOAN HOW WILL I HELP MY FAMILY",0,0.0
46,1289423488198090752,tweet,2020-08-01 04:51:30,@preeti112019 LT - Larsen &amp; Toubro or LT foods?,0,0.0
47,1289409740355694593,tweet,2020-08-01 03:56:52,Metro Rail Webinar Series 2020: On the right track  Read more https://t.co/ktu0JMXZ5Y @EliasGeorgeKPMG @Uttarakhand GK METRO @Mumbai Metro Rail Corporation - MMRC @ranjitsinghdeol @TrimbleIndia @Tekla @OfficialDMRC @Larsen &amp; Toubro,1,0.3928571428571429
48,1289290402298605568,tweet,2020-07-31 20:02:40,@SavitaSikarwar @sunita_yadav122 @nishasinghji Exactly even I'm the employee of Larsen and toubro..... I know better about it [ kiske kitne bade kaam hai !! ],1,0.515625
49,1289287228309438465,tweet,2020-07-31 19:50:03,"A message from A. M. Naik, Group Chairman – Larsen &amp; Toubro and Non-Executive Chairman – Mindtree - https://t.co/oglan7XV1O | #COVID19  | #StayHome",0,0.0
50,1289273149125607424,tweet,2020-07-31 18:54:06,"@zhr_jafri Would also love to read a simplanations post on the Indian heavy engineering giant, L&amp;T, which was founded by two Danish engineers in the pre-independence era, Henning Holck-Larsen &amp; Søren Kristian Toubro.  From an interview in 1976 : https://t.co/leN1rcgC7R",1,0.1
51,1289201261330407426,retweet,2020-07-31 14:08:27,"Larsen &amp; Toubro (L&amp;T), and parent firm of @LTI_Global had offered to build the Ram Mandir in Ayodhya over ruins of demolished #BabriMasjid for free.  With the upcoming ground breaking ceremony, L&amp;T is also set to be enabler of a fasc!st ideology.   https://t.co/r9Fb5wgxY3",1,0.01666666666666668
52,1289200357361377280,retweet,2020-07-31 14:04:52,"Larsen &amp; Toubro (L&amp;T), and parent firm of @LTI_Global had offered to build the Ram Mandir in Ayodhya over ruins of demolished #BabriMasjid for free.  With the upcoming ground breaking ceremony, L&amp;T is also set to be enabler of a fasc!st ideology.   https://t.co/r9Fb5wgxY3",1,0.01666666666666668
53,1289198460852301824,retweet,2020-07-31 13:57:19,"Larsen &amp; Toubro (L&amp;T), and parent firm of @LTI_Global had offered to build the Ram Mandir in Ayodhya over ruins of demolished #BabriMasjid for free.  With the upcoming ground breaking ceremony, L&amp;T is also set to be enabler of a fasc!st ideology.   https://t.co/r9Fb5wgxY3",1,0.01666666666666668
54,1289070514791751681,retweet,2020-07-31 05:28:55,"@WCWOA @CocoCha31775669 @myvisajobs @USCIS @DHS_Wolf @realDonaldTrump @USCongress @USDOL @StateDept ""Is #H1BVisa program out of control ?""  ""Larsen &amp; Toubro is now under investigation by USCIS for the practices, according to the suit, which is seeking class-action status. .. submitted fake invitation letters purportedly signed by client Apple Inc.""  https://t.co/ltQ8jsLC7Q",-1,-0.5
55,1289052560549003268,tweet,2020-07-31 04:17:34,"We are pleased to have Mr. R Shankar Narayanan, Head - Corporate Centre, Larsen &amp; Toubro Construction, to speak at the live webinar on ""Productivity in the construction industry"" on 11Aug, 12pm via GoToWebinar  To register - https://t.co/pJMMDuHfz8 https://t.co/AhdkPBUt8G",1,0.21212121212121213
56,1289047835225100289,tweet,2020-07-31 03:58:47,"Hi friends, Larsen &amp; Toubro is hiring Civil Engineers in #JammuAndKashmir. Qualification - Bachelor's degree in #Civil #Engineering Both #freshers and experienced graduates can apply. #Jobs https://t.co/kcnpw0FwVb",1,0.8
57,1289044047324016640,tweet,2020-07-31 03:43:44,#FridayForecast Call - Bullish on LARSEN &amp; TOUBRO 📈 What are your views? 🤔  #edificationacademy #Trader #money #stocks #StockMarket #StocksToTrade #finance #invest #Investment #investor  #NSE #bse #financialadvisor  @NSEIndia @BSEIndia @bse_sensex @EdificationAD https://t.co/jIvmeu0hZZ,0,0.0
58,1289043319109165058,retweet,2020-07-31 03:40:51,"@WCWOA @CocoCha31775669 @myvisajobs @USCIS @DHS_Wolf @realDonaldTrump @USCongress @USDOL @StateDept ""Is #H1BVisa program out of control ?""  ""Larsen &amp; Toubro is now under investigation by USCIS for the practices, according to the suit, which is seeking class-action status. .. submitted fake invitation letters purportedly signed by client Apple Inc.""  https://t.co/ltQ8jsLC7Q",-1,-0.5
59,1288960621699125249,retweet,2020-07-30 22:12:14,"Larsen &amp; Toubro (L&amp;T), and parent firm of @LTI_Global had offered to build the Ram Mandir in Ayodhya over ruins of demolished #BabriMasjid for free.  With the upcoming ground breaking ceremony, L&amp;T is also set to be enabler of a fasc!st ideology.   https://t.co/r9Fb5wgxY3",1,0.01666666666666668
60,1288856917058543627,retweet,2020-07-30 15:20:09,"Larsen &amp; Toubro (L&amp;T), and parent firm of @LTI_Global had offered to build the Ram Mandir in Ayodhya over ruins of demolished #BabriMasjid for free.  With the upcoming ground breaking ceremony, L&amp;T is also set to be enabler of a fasc!st ideology.   https://t.co/r9Fb5wgxY3",1,0.01666666666666668
61,1288853161999032322,retweet,2020-07-30 15:05:14,"Larsen &amp; Toubro (L&amp;T), and parent firm of @LTI_Global had offered to build the Ram Mandir in Ayodhya over ruins of demolished #BabriMasjid for free.  With the upcoming ground breaking ceremony, L&amp;T is also set to be enabler of a fasc!st ideology.   https://t.co/r9Fb5wgxY3",1,0.01666666666666668
62,1288841135562141696,retweet,2020-07-30 14:17:26,"Larsen &amp; Toubro (L&amp;T), and parent firm of @LTI_Global had offered to build the Ram Mandir in Ayodhya over ruins of demolished #BabriMasjid for free.  With the upcoming ground breaking ceremony, L&amp;T is also set to be enabler of a fasc!st ideology.   https://t.co/r9Fb5wgxY3",1,0.01666666666666668
63,1288837917956169728,retweet,2020-07-30 14:04:39,Stage is set at #Bangalore Metro's Cantonment Station for launching Phase 2's tunneling works!  Karnataka's CM @BSYBJP will likely be there to witness Larsen &amp; Toubro's TBM Urja build temporary rings within the station.   #Soon https://t.co/YUmXxSu9RJ https://t.co/hvibCvQLXj,0,0.0
64,1288836761217622016,tweet,2020-07-30 14:00:03,"Larsen &amp; Toubro Limited fosters a culture of collaboration, continuous learning with #Microsoft #Teams - #Quadrasystems.net #India #PowerApps Sanjay Mishra Vinay Khargonkar Anantha Sayana https://t.co/10bEZvak8d",-1,-0.07142857142857142
65,1288834720873111553,tweet,2020-07-30 13:51:57,"@SonuSood  sir you talk to ISRO Sivan, Sir &amp;big engineer how divert floods water Please   every year  floods in assam  Bihar uttarakhand   no permanent solution, why not bring interlink river project   Assam Save Animals, Larsen &amp;toubro big industry consult government",0,0.0
66,1288805388133871616,retweet,2020-07-30 11:55:24,Beginning of World largest nuclear project. Some of part made by Indian company Larsen and Toubro. My story.  #ITER #NuclearEnergy #energy #fussion #reactor #atomic #India #France #Science #technology @iterorg @WorldNuclear https://t.co/Wfv4xQ4vP3,0,0.0
67,1288792730781417472,retweet,2020-07-30 11:05:06,"@viveksheth1988 @dmuthuk Larsen &amp; Toubro make artillery which also kills people . And as far as I know , Larsen also makes a profit. No one is being forced to consume a product , it’s a choice.",-1,-0.10000000000000002
68,1288780114784710656,retweet,2020-07-30 10:14:58,"Larsen &amp; Toubro, India’s leading engineering, construction, technology, manufacturing &amp; financial services conglomerate has flagged-off the most complex and final assembly of Cryostat, largest stainless-steel, high-vacuum pressure chamber in the world. https://t.co/FO3QFBjTy7",1,0.05
69,1288746891195240449,tweet,2020-07-30 08:02:57,"@satpathy_gaurav @SudhanshuTrived Thank God Ambanis couldn't take over Larsen &amp;Toubro, which they tried to do twice. Mota bhai would have been making Our Nuclear submarine Arihant that way and Anil making boats in pipavav shipyard to Raffles. Oblivious to the fact that , Gandhi's best abode was GD Birla's house",1,1.0
70,1288740591291965443,retweet,2020-07-30 07:37:55,"Larsen &amp; Toubro (L&amp;T), and parent firm of @LTI_Global had offered to build the Ram Mandir in Ayodhya over ruins of demolished #BabriMasjid for free.  With the upcoming ground breaking ceremony, L&amp;T is also set to be enabler of a fasc!st ideology.   https://t.co/r9Fb5wgxY3",1,0.01666666666666668
71,1288731694439120897,retweet,2020-07-30 07:02:34,"@viveksheth1988 @dmuthuk Larsen &amp; Toubro make artillery which also kills people . And as far as I know , Larsen also makes a profit. No one is being forced to consume a product , it’s a choice.",-1,-0.10000000000000002
72,1288731071324909568,retweet,2020-07-30 07:00:05,"@viveksheth1988 @dmuthuk Larsen &amp; Toubro make artillery which also kills people . And as far as I know , Larsen also makes a profit. No one is being forced to consume a product , it’s a choice.",-1,-0.10000000000000002
73,1288728819197591553,retweet,2020-07-30 06:51:08,"@viveksheth1988 @dmuthuk Larsen &amp; Toubro make artillery which also kills people . And as far as I know , Larsen also makes a profit. No one is being forced to consume a product , it’s a choice.",-1,-0.10000000000000002
74,1288728472790028289,retweet,2020-07-30 06:49:45,"@viveksheth1988 @dmuthuk Larsen &amp; Toubro make artillery which also kills people . And as far as I know , Larsen also makes a profit. No one is being forced to consume a product , it’s a choice.",-1,-0.10000000000000002
75,1288722702962839553,retweet,2020-07-30 06:26:50,"@viveksheth1988 @dmuthuk Larsen &amp; Toubro make artillery which also kills people . And as far as I know , Larsen also makes a profit. No one is being forced to consume a product , it’s a choice.",-1,-0.10000000000000002
76,1288722246949732353,retweet,2020-07-30 06:25:01,"@viveksheth1988 @dmuthuk Larsen &amp; Toubro make artillery which also kills people . And as far as I know , Larsen also makes a profit. No one is being forced to consume a product , it’s a choice.",-1,-0.10000000000000002
77,1288719696720732161,tweet,2020-07-30 06:14:53,"@viveksheth1988 @dmuthuk Larsen &amp; Toubro make artillery which also kills people . And as far as I know , Larsen also makes a profit. No one is being forced to consume a product , it’s a choice.",-1,-0.10000000000000002
78,1288692155028893698,tweet,2020-07-30 04:25:27,Beginning of World largest nuclear project. Some of part made by Indian company Larsen and Toubro. My story.  #ITER #NuclearEnergy #energy #fussion #reactor #atomic #India #France #Science #technology @iterorg @WorldNuclear https://t.co/Wfv4xQ4vP3,0,0.0
79,1288661255905931265,retweet,2020-07-30 02:22:40,Stage is set at #Bangalore Metro's Cantonment Station for launching Phase 2's tunneling works!  Karnataka's CM @BSYBJP will likely be there to witness Larsen &amp; Toubro's TBM Urja build temporary rings within the station.   #Soon https://t.co/YUmXxSu9RJ https://t.co/hvibCvQLXj,0,0.0
80,1288640316627542016,retweet,2020-07-30 00:59:27,"Larsen &amp; Toubro (L&amp;T), and parent firm of @LTI_Global had offered to build the Ram Mandir in Ayodhya over ruins of demolished #BabriMasjid for free.  With the upcoming ground breaking ceremony, L&amp;T is also set to be enabler of a fasc!st ideology.   https://t.co/r9Fb5wgxY3",1,0.01666666666666668
81,1288626533863772160,retweet,2020-07-30 00:04:41,Stage is set at #Bangalore Metro's Cantonment Station for launching Phase 2's tunneling works!  Karnataka's CM @BSYBJP will likely be there to witness Larsen &amp; Toubro's TBM Urja build temporary rings within the station.   #Soon https://t.co/YUmXxSu9RJ https://t.co/hvibCvQLXj,0,0.0
82,1288577254881017856,retweet,2020-07-29 20:48:52,"Larsen &amp; Toubro (L&amp;T), and parent firm of @LTI_Global had offered to build the Ram Mandir in Ayodhya over ruins of demolished #BabriMasjid for free.  With the upcoming ground breaking ceremony, L&amp;T is also set to be enabler of a fasc!st ideology.   https://t.co/r9Fb5wgxY3",1,0.01666666666666668
83,1288576265574690816,retweet,2020-07-29 20:44:56,"Larsen &amp; Toubro (L&amp;T), and parent firm of @LTI_Global had offered to build the Ram Mandir in Ayodhya over ruins of demolished #BabriMasjid for free.  With the upcoming ground breaking ceremony, L&amp;T is also set to be enabler of a fasc!st ideology.   https://t.co/r9Fb5wgxY3",1,0.01666666666666668
84,1288567970159931392,retweet,2020-07-29 20:11:59,Stage is set at #Bangalore Metro's Cantonment Station for launching Phase 2's tunneling works!  Karnataka's CM @BSYBJP will likely be there to witness Larsen &amp; Toubro's TBM Urja build temporary rings within the station.   #Soon https://t.co/YUmXxSu9RJ https://t.co/hvibCvQLXj,0,0.0
85,1288562922109595648,retweet,2020-07-29 19:51:55,Stage is set at #Bangalore Metro's Cantonment Station for launching Phase 2's tunneling works!  Karnataka's CM @BSYBJP will likely be there to witness Larsen &amp; Toubro's TBM Urja build temporary rings within the station.   #Soon https://t.co/YUmXxSu9RJ https://t.co/hvibCvQLXj,0,0.0
