,ID,Status,Created At,Text,Polarity
199,1264860412534599680,tweet,2020-05-25 10:06:36,"@swatision Dear Swati Aggarwal, We represent SBI Credit Cards only. For banking related queries/feedbacks, please contact SBI Branch. You can get in touch with them through their Twitter handle @TheOfficialSBI or their website https://t.co/t1uwcjKjit.",0
198,1264860192006565891,tweet,2020-05-25 10:05:44,"@anjanikant0987 Dear Anjani Kant, We thank you for showing interest in SBI Card. Unfortunately, we regret to inform you that we are unable to issue a credit card to you as the details furnished do not meet the policies set forth for issuance of credit card.",0
197,1264860104354074625,tweet,2020-05-25 10:05:23,"@Nikhilkvyas @SBICard_Connect Dear Nikhil Vyas, all SBI Credit Cards concerns/queries need to be directed to SBICard_Connect. For more information please visit https://t.co/fTda2QZvnp",0
196,1264859598961270784,tweet,2020-05-25 10:03:23,@Rahul951990 1. Log on to https://t.co/Xk0jIzDFAE with your SBI Card Online user id &amp; password and click on ‘Flexipay’ tab on the left hand navigation under 'Benefits' section 2. Select the transactions you want to convert to Flexipay &amp; click on 'Show Offer' button,0
195,1264859508318171137,tweet,2020-05-25 10:03:01,"@Rahul951990 Dear Customer,   You can convert any SBI Card transaction into EMI by logging on to https://t.co/Xk0jIzDFAE. Follow these simple steps to book a Flexipay successfully-",0
194,1264859379062337536,tweet,2020-05-25 10:02:30,Cash not dispensed from ATM but amount debited. Toll free no. &amp; SBI site message- 'we regret our inability to lodge your concern'. Kindly tell me who do I contact for my concern @TheOfficialSBI @SBICard_Connect,0
193,1264859363899920386,retweet,2020-05-25 10:02:26,SBI Mobile ATM Van in  Ahmedabad offered ATM services to BSF Jawans near their Camp.They utilised ATM services with  Social distancing and utmost discipline. They were very happy and appreciated the efforts by SBI during #COVID19. @TheOfficialSBI  @DFSFightsCorona https://t.co/gVDu6CNpph,0
192,1264859350029332480,retweet,2020-05-25 10:02:23,"Mr Amit Kumar, working at Pipavav Port and young customer of our SBI Rajula Branch,Amreli Region in Bhavnagar Module appreciating the services rendered by the Branch during these difficult times.  @DFSFightsCorona  @FinMinIndia  @CMOGuj https://t.co/avQDwU5ocm",0
191,1264859334942453762,retweet,2020-05-25 10:02:20,CSPs linked to SBI Branches of Amreli Region in Bhavnagar Module are rendering services to customers with all precautionary measures in their fight against #COVID19. @DFSFightsCorona  @FinMinIndia  @CMOGuj https://t.co/aDKke8BKOn,0
190,1264859289815937025,tweet,2020-05-25 10:02:09,"@SBICard_Connect Finally, after 10 yrs getting rid of my SBI CC relation as I find the service to be insecure, unreliable and unaccountable to customer relation. Classic example of 20 year reputation wiped away by 1 transaction.",0
189,1264859177765257217,retweet,2020-05-25 10:01:42,@freenaynow @JoeBiden Everyone assigned to NSC should be subject to SBI process with CI polygraph.,0
188,1264859059523670018,tweet,2020-05-25 10:01:14,@TheOfficialSBI https://t.co/B4rU6nWQG7. Under this link 100% wavier on processing fee is claimed by your branch .Why my processing fee was taken.??? https://t.co/WjMtuSIX3m,0
187,1264858814320381952,tweet,2020-05-25 10:00:15,"@HDFCBank_Cares I want to avail EmI moratorium extension till  Aug 2020 , what is the procedure? 2) Also my current home loan rate is 8.90% &amp; portal says that I can avail 8.10% by paying 5900? if that is case i will shift to SBI HOme loan",0
186,1264858750726225922,tweet,2020-05-25 10:00:00,"@VijuyRonjan Sir, u can also add few things also, may this occasion brings a positive strength and self consciousness to those SBI staff, whose in-sensitiveness leads to a reason of loss of innocents customers.    Amin!!!!",0
185,1264858718761480197,tweet,2020-05-25 09:59:53,@NeptuneSun1 @utsav1711 Pls check impact section in https://t.co/R3STxT15Xq,0
184,1264858642303467520,retweet,2020-05-25 09:59:34,100+ daughters rescued 1000+ Gaumata saved 10000+ brought to Vedas. Dalits/tribals integrated w/ Janeu-Yajna  50 books Gaushalas Arresting criminals  and more..  This is Agniveer  Support 1 UPI- agniveerupi@sbi 2 Ind https://t.co/BCufI8w21p 3 Outside Ind https://t.co/kv0sOboFI0 https://t.co/5NuIGh404p,0
183,1264858430713389057,retweet,2020-05-25 09:58:44,@freenaynow @JoeBiden Everyone assigned to NSC should be subject to SBI process with CI polygraph.,0
182,1264857881217622017,tweet,2020-05-25 09:56:33,@TheOfficialSBI hi. I wanted to raise a complaint in written format against the sbi home loan processing officer and authorized HLC vendor who works for SBI in secunderabad area. Please let me know the branch and address. Its about asking customer from money for processing loan.,0
181,1264857733221638145,tweet,2020-05-25 09:55:58,@freenaynow @JoeBiden Everyone assigned to NSC should be subject to SBI process with CI polygraph.,0
180,1264857565835546636,retweet,2020-05-25 09:55:18,"With @PIXSTOX, we have been tracking bond liquidity. In last 3M, 40 of REC and 37 Bonds of HDFC were most traded. REC-SR189-7.92-31MAR30 traded 229 times and HDFC-SR009-6.99-13FEB23  184 times. Last week 519 Bonds traded. Top Issuers PFC, REC, SBI, NABARD and Indian Rail Finance. https://t.co/1XVWzToYGJ",0
179,1264857544436023296,tweet,2020-05-25 09:55:13,@chin_raval @ipo_mantra Exactly.. same here.. &amp; SBI is trusted and will be trustable further..,0
178,1264857094378762241,tweet,2020-05-25 09:53:25,@SBICard_Connect Will share the telephonic recordings of Sbi card executive ! Amd I request all othernpeople to share it as much as possible so other people dont get cheated! Sbi cheat @SBICard_Connect @RBI @FinMinIndia  @nsitharaman,0
177,1264857074518724608,tweet,2020-05-25 09:53:21,@SBICard_Connect I have made transction on my sbi card and now i want to convert into emi but there is no support i can't connect you so can u plz arrange call back for me. THANKS SBI Card,0
176,1264856737703759878,retweet,2020-05-25 09:52:00,4) SBI MF wrote a letter to SEBI alleging fund diversion and fraud and asking for action against past and present directors of Reliance Home Finance. Nothing has come of it.,0
175,1264856702773612544,retweet,2020-05-25 09:51:52,1) Close ended funds (mostly FMPs) saw collapse in NFOs in FY19 2) Many held too few papers and were hit by defaults 3) Some were mis-sold as FD. In one case a textile mill worker was sold a close end hybrid fund by SBI. It had ADAG paper which defaulted.  https://t.co/v3XGnFxp6c,0
174,1264856573370945536,retweet,2020-05-25 09:51:21,Agniveer is helping family rebuild house. Contribute 4 tribal welfare  UPI/GPay- agniveerupi@sbi  Card/PayTM/NEFT https://t.co/hG3ML2dOLu  Only Ind (80G tax rebate) Jan Swabhiman Welfare Society Savings A/C-000701254577 IFSC-ICIC0000007  Outside Ind https://t.co/1F1DZQMaT1,0
173,1264856199725494273,tweet,2020-05-25 09:49:52,"@SPKumar46846759 excluding such information to enable our team to respond. Further, please note that SBI or its employees will never send any payment link or ask for sensitive information like VPA-UPI related, User ID, PIN, Internet Banking passwords, CVV No, OTP, etc., through (2/3)",0
172,1264856190028136449,tweet,2020-05-25 09:49:50,@sarangamle @utsav1711 The best bank   SBi,0
171,1264856093571928069,tweet,2020-05-25 09:49:27,@SBI_FOUNDATION @TheOfficialSBI what is the process for apply Education Loan moratorium period for this covid19 pendancy,0
170,1264856035824594945,tweet,2020-05-25 09:49:13,"@atul7173 Dear Atul Joshi, Can you confirm if your query is related to SBI debit cards or SBI credit cards? We handle queries related to SBI Credit Card. For SBI Debit card or Bank related queries, please connect with @TheOfficialSBI or visit https://t.co/mCNeDoSOf0",0
169,1264856031399686144,tweet,2020-05-25 09:49:12,@RBI @nsitharaman @aibea_india @IBA_org_in #fact Depositors interests were not being protected as interest rates touch down most of depositers complaints. Rajnish Kumar chairman SBI,0
168,1264855784598446080,tweet,2020-05-25 09:48:13,@ipo_mantra What's ur opinion about #SBI_card in future perspective ?,0
167,1264855612158029824,retweet,2020-05-25 09:47:32,@TheOfficialSBI I have a savings account with SBI. The transactions for the FY 2018-19 are not available in internet banking as the same are archieved. Kindly help.,0
166,1264855224843460609,tweet,2020-05-25 09:46:00,@TheOfficialSBI I have a savings account with SBI. The transactions for the FY 2018-19 are not available in internet banking as the same are archieved. Kindly help.,0
165,1264854946912055302,tweet,2020-05-25 09:44:53,@EdgeCng SBI's loan processing is carried out with complete transparency and as per laid down rules and guidelines. Thank you.,0
164,1264854863999049728,retweet,2020-05-25 09:44:34,Apply for Krishi Gold loan on YONO SBI App https://t.co/k9iDgDcieg,0
163,1264854824106876928,retweet,2020-05-25 09:44:24,Coming up at 5pm | Women participation In Boardrooms at 17% in top 500 cos! IiAS &amp; SBI MF author a report on gender diversity on boards to improve corporate governance. Shyamla Gopinath @hdfcbank Naina Lal Kidwai @Advent Amit Tandon @iias Navneet Munot @sbimf join us https://t.co/jI9V1UdHNq,0
162,1264854616908447744,retweet,2020-05-25 09:43:35,"In case of IRCTC , I suggested whomsoever I spoke with to buy as much as possible from market right on listing.  In case of SBI Cards, my suggestion to everyone would be to exit on listing gains &amp; forget it for future. Review after FY20 earnings.  Better opportunities elsewhere.",0
161,1264854504400400384,retweet,2020-05-25 09:43:08,Coming up at 5pm | Women participation In Boardrooms at 17% in top 500 cos! IiAS &amp; SBI MF author a report on gender diversity on boards to improve corporate governance. Shyamla Gopinath @hdfcbank Naina Lal Kidwai @Advent Amit Tandon @iias Navneet Munot @sbimf join us https://t.co/jI9V1UdHNq,0
160,1264853999888580609,retweet,2020-05-25 09:41:08,"Bipin Bihari Goudu ,State-Odisha having SBI Ac-30602697695 M-8117879240 has been hacked and Rs 15500 has been withdrawn from bank account through @PhonePe_.I request @PhonePeSupport @phonepe_safety @TheOfficialSBI to take necessary action to refund this amount. @RBI @FinMinIndia https://t.co/vSQKtDlBDT",0
159,1264853775707189249,tweet,2020-05-25 09:40:14,#SBI Bank not responding to customers call,0
158,1264853247283433474,tweet,2020-05-25 09:38:08,"@TheOfficialSBI  i am not getting Rewardz point. unable to register in SBI Rewardz show error profile missing, no profile recived from bank and yonu app its show NO CUSTOMER FOUND.i have send mail, call customer support, visited branch problem is not solved till today. https://t.co/iS6cT4Hqf2",0
157,1264853232494546945,retweet,2020-05-25 09:38:05,@lohewaliladki Interesting aspect of SBI logo is that Shekhar Kamat designed it by taking inspiration from the Kankaria Lake in Ahmedabad. Just try zooming into the google maps and you will find the SBI logo.😊👍 https://t.co/NkADj0Y26w,0
156,1264853228711272449,retweet,2020-05-25 09:38:04,"A crisis on this scale can reorder society in dramatic ways, for better or worse. Here are 34 big thinkers’ predictions for what’s to come. https://t.co/sQaTXd2xKW",0
155,1264853211841810432,tweet,2020-05-25 09:38:00,@triodosuk_help We are a small microfinance institution having presence in two states Our share capital is INR 25000000. India's largest bank SBI is our lender. In our expansion plan we want to raise capital from INR 2.5 crore to INR 10 crore. Can we collaborate with your bank,0
154,1264853148579004422,retweet,2020-05-25 09:37:45,Agniveer is helping family rebuild house. Contribute 4 tribal welfare  UPI/GPay- agniveerupi@sbi  Card/PayTM/NEFT https://t.co/hG3ML2dOLu  Only Ind (80G tax rebate) Jan Swabhiman Welfare Society Savings A/C-000701254577 IFSC-ICIC0000007  Outside Ind https://t.co/1F1DZQMaT1,0
153,1264853123769569281,retweet,2020-05-25 09:37:39,"A crisis on this scale can reorder society in dramatic ways, for better or worse. Here are 34 big thinkers’ predictions for what’s to come. https://t.co/sQaTXd2xKW",0
152,1264853115708346368,tweet,2020-05-25 09:37:37,@lohewaliladki Interesting aspect of SBI logo is that Shekhar Kamat designed it by taking inspiration from the Kankaria Lake in Ahmedabad. Just try zooming into the google maps and you will find the SBI logo.😊👍 https://t.co/NkADj0Y26w,0
151,1264853104060764167,retweet,2020-05-25 09:37:34,@Justice4RRB @UFBUIndia @aibea_india @Bankers_United @officialAIBOC @AIRRBEA3 @JagranNews Merger of all RRBs in SBI Bank,0
150,1264853042165243912,tweet,2020-05-25 09:37:19,@NBARIK7 Vodafone idea - hold SBI- sell it if there is upward momentum.. Vedanata- watch the delisting progress...you can average if it goes below 87.,0
149,1264853031650238464,tweet,2020-05-25 09:37:17,Coming up at 5pm | Women participation In Boardrooms at 17% in top 500 cos! IiAS &amp; SBI MF author a report on gender diversity on boards to improve corporate governance. Shyamla Gopinath @hdfcbank Naina Lal Kidwai @Advent Amit Tandon @iias Navneet Munot @sbimf join us https://t.co/jI9V1UdHNq,0
148,1264852475544309760,retweet,2020-05-25 09:35:04,"Fulfil your banking needs with SBI Quick. Apply for loan, generate green pin, and much more from home. #SBI #SBIQuick #SafeBanking #GharSeBanking Know more: https://t.co/LDQuBYntTq https://t.co/lYC1sHb4eK",0
147,1264852467172421633,tweet,2020-05-25 09:35:02,Kindly suggest me where i complaint against fraud of SBI Customer Service Point (Bank Mitra)online because local bank branch not take action on this. @TheOfficialSBI @SBI_FOUNDATION,0
146,1264852450986602498,tweet,2020-05-25 09:34:58,"@myvoltas   man 1: how to be a SBI Bank's clerk ??  man 2: be first  ""voltas AC installation service guy""   man 1: why ??  man 2: that how you could practice and learn ""counter no. 2 pe jao.... umang ji se pucho bade sahab h vo....   🤣🤣🤣",0
145,1264852430044508161,tweet,2020-05-25 09:34:53,"@VishalB48988714 as it may lead to frauds. You may report such cases to your nearest SBI branch, our email id (epg.cms@sbi.co.in) &amp; to the law enforcement agencies operating in your area. (2/2)",0
144,1264852429125890048,tweet,2020-05-25 09:34:53,"@VishalB48988714 Dear Customer, please note SBI or its employees will never seek sensitive information like user id, PIN, internet banking passwords, CVV No, OTP, etc., through phone/SMS/email. We request you to not divulge account related information to anyone over the phone/email/SMS (1/2)",0
143,1264852050879414279,tweet,2020-05-25 09:33:23,@StockStories3 Wth ??? What all r u holding besides Sbi cards ???,0
142,1264851404448915456,retweet,2020-05-25 09:30:49,Agniveer is helping family rebuild house. Contribute 4 tribal welfare  UPI/GPay- agniveerupi@sbi  Card/PayTM/NEFT https://t.co/hG3ML2dOLu  Only Ind (80G tax rebate) Jan Swabhiman Welfare Society Savings A/C-000701254577 IFSC-ICIC0000007  Outside Ind https://t.co/1F1DZQMaT1,0
141,1264851323905691648,tweet,2020-05-25 09:30:30,@SonuSood please help me please help me A/C 35203940570 IFSC SBIN 1101540 sbi,0
140,1264851186303348738,retweet,2020-05-25 09:29:57,Apply for Krishi Gold loan on YONO SBI App https://t.co/k9iDgDcieg,0
139,1264851012885479434,tweet,2020-05-25 09:29:15,"@OnePlus_IN And @OnePlus_Support Sbi Offers Applicable, Pop Bundle Sale Oneplus 8 pro May 28th Onwards..",0
138,1264850169083785216,tweet,2020-05-25 09:25:54,@TheOfficialSBI NO BRANCH OF SBI ENTERTAIN ME FOR HOME LOAN QUERY KINDLY HELP,0
137,1264850036912910336,retweet,2020-05-25 09:25:23,Apply for Krishi Gold loan on YONO SBI App https://t.co/k9iDgDcieg,0
136,1264849896567451649,tweet,2020-05-25 09:24:49,"@ranjitkamboj12 excluding such information to enable our team to respond. Further, please note that SBI or its employees will never send any payment link or ask for sensitive information like VPA-UPI related, User ID, PIN, Internet Banking passwords, CVV No, OTP, etc., through (2/3)",0
135,1264849692313227265,retweet,2020-05-25 09:24:01,Agniveer is helping family rebuild house. Contribute 4 tribal welfare  UPI/GPay- agniveerupi@sbi  Card/PayTM/NEFT https://t.co/hG3ML2dOLu  Only Ind (80G tax rebate) Jan Swabhiman Welfare Society Savings A/C-000701254577 IFSC-ICIC0000007  Outside Ind https://t.co/1F1DZQMaT1,0
134,1264849622138159106,retweet,2020-05-25 09:23:44,Agniveer is helping family rebuild house. Contribute 4 tribal welfare  UPI/GPay- agniveerupi@sbi  Card/PayTM/NEFT https://t.co/hG3ML2dOLu  Only Ind (80G tax rebate) Jan Swabhiman Welfare Society Savings A/C-000701254577 IFSC-ICIC0000007  Outside Ind https://t.co/1F1DZQMaT1,0
133,1264849185083404288,retweet,2020-05-25 09:22:00,"Interesting. Here's another article from FXCoin about using XRP for B2B tx. Apologies for the limited translation but I believe it indicates SBI mentioned leveraging XRP for corporate group settlements and that a swap market is necessary, involving FXCoin. https://t.co/2ItxEZZqhp",0
132,1264849089725730820,tweet,2020-05-25 09:21:37,"@SKGahlawat1 @TheOfficialSBI @RBI @nsitharaman @PMOIndia All Banks are making huge profits out of miseries of borrowers. We considered SBI to be different from other selfish banks. But I think SBI is also loosing way. SBI, you have to lead in interest reduction to be front line bank",0
131,1264848980770422784,retweet,2020-05-25 09:21:11,"Shopping and saving dono, with YONO! This Eid, go shopping on Flipkart via YONO SBI and get 5% additional cashback* up to ₹750 on using SBI debit/credit card. Download now: https://t.co/yjDSsj2O4L #YONOSBI https://t.co/V70NpxgzTc",0
130,1264848838285619200,tweet,2020-05-25 09:20:37,"Name of the Account: PM CARES Account Number: 2121PM20202 IFSC Code: SBIN0000691 SWIFT Code: SBININBB104 Name of Bank &amp; Branch: State Bank of India, New Delhi Main Branch UPI ID: pmcares@sbi",0
129,1264848591215976449,tweet,2020-05-25 09:19:38,SBI bank share analysis | Best Bank stock to buy in 2020 - Hindi https://t.co/yfFvRIjXgI via @YouTube,0
128,1264848081536708608,tweet,2020-05-25 09:17:37,SBI at multi year support. 146-148. What's next? Further downward movement? https://t.co/gtHMlRaNbW,0
127,1264848011458424834,retweet,2020-05-25 09:17:20,#Jobopening Apply for the role of - Deputy Manager (Communications)– SBI Youth for India Fellowship -  at SBI Foundation   Details  - https://t.co/BUMFaPgnit  #Communication #SBIYFI @sbi_yfi https://t.co/Ph1WzOrzkc,0
126,1264847943179304960,retweet,2020-05-25 09:17:04,#Jobopening Apply for the role of - Deputy Manager (Communications)– SBI Youth for India Fellowship -  at SBI Foundation   Details  - https://t.co/BUMFaPgnit  #Communication #SBIYFI @sbi_yfi https://t.co/Ph1WzOrzkc,0
125,1264847789839675392,tweet,2020-05-25 09:16:27,Why SBI degraded  its preferential  treatment to poor  and issuing  CSP subjected  them to callo8 dirty game of many  operators  who withdraw  more money  and even more  rebuke  and humilluate poor  customers  on specific  complaints. Sr authorities  hardly  address concerns,0
124,1264847370379911168,tweet,2020-05-25 09:14:47,"#UninstallTikTok No WhatsApp No tiktok No Phone Pay,No Google Pay, No Paytm... using only SBI netbanking",0
123,1264847196177854466,retweet,2020-05-25 09:14:05,"#SBI :: weekly long term chart ,looks like a large complex correction ( form of expanded flat ) of almost 10 years is about to end in the zone of 130-150...#Elliottwave  #banknifty  should watch out for some positive candle formation on weekly which is still not there https://t.co/nnfKkbVgGR",0
122,1264846888605331457,tweet,2020-05-25 09:12:52,"@SBICard_Connect @santoshnaraya13 Kindly call me also, It has been two months now that I have been running behind SBI for my credit card closure but no one has ever called me. Details already shared on direct message long back",0
121,1264846873195614208,tweet,2020-05-25 09:12:48,@ipo_mantra But SBI cards i guess will surely fight back good as it's a futuristic market player.,0
120,1264846709491982342,retweet,2020-05-25 09:12:09,@utsav1711 SBI is showing this on their website,0
119,1264845889539117057,tweet,2020-05-25 09:08:54,"@myvoltas @VoltasBeko  your voltas installation services are pathetic  i bought 2 split ACs on 19th but till now not a single AC installation took place..  are you guys really service provider or worst than SBI.... ""isse baat kro ... usse baat kro""",0
118,1264845345508470784,tweet,2020-05-25 09:06:44,"@srvindl Dear Customer, please submit your request at our Regional Business Office (RBO) operating in your area. You may visit https://t.co/22djS1UqNp for the address of the RBO. The address can also be obtained from any of our nearby branches. It is displayed in the banking hall (1/2)",0
117,1264845095943024646,tweet,2020-05-25 09:05:45,@ishanagarwal24 What's the point of the popup box in India if it won't have the same SBI card discount btw?  We save 4k on amazon on the normal sale... isn't that better than the popup box?,0
116,1264844805202341888,tweet,2020-05-25 09:04:35,"@aks_rulez Dear Akash Singh, We handle queries related to SBI Credit Card. Please connect with @TheOfficialSBI or visit https://t.co/mCNeDoSOf0 for queries related to SBI Debit card or Bank related queries.",0
115,1264844561983115264,retweet,2020-05-25 09:03:37,SBI Mobile ATM Van in  Ahmedabad offered ATM services to BSF Jawans near their Camp.They utilised ATM services with  Social distancing and utmost discipline. They were very happy and appreciated the efforts by SBI during #COVID19. @TheOfficialSBI  @DFSFightsCorona https://t.co/gVDu6CNpph,0
114,1264844477321170944,retweet,2020-05-25 09:03:17,"Mr Amit Kumar, working at Pipavav Port and young customer of our SBI Rajula Branch,Amreli Region in Bhavnagar Module appreciating the services rendered by the Branch during these difficult times.  @DFSFightsCorona  @FinMinIndia  @CMOGuj https://t.co/avQDwU5ocm",0
113,1264844460539641857,retweet,2020-05-25 09:03:13,CSPs linked to SBI Branches of Amreli Region in Bhavnagar Module are rendering services to customers with all precautionary measures in their fight against #COVID19. @DFSFightsCorona  @FinMinIndia  @CMOGuj https://t.co/aDKke8BKOn,0
112,1264843380019904515,tweet,2020-05-25 08:58:56,"@sakhhtlaunda Dear sakhhtlaunda, all SBI Credit Cards concerns/queries need to be directed to @SBICard_Connect. For more information please visit https://t.co/fTda2QZvnp",0
110,1264843213212450816,tweet,2020-05-25 08:58:16,"@heeralaljoshi Dear Heeralal Joshi, please refer to the schedule of charges available at https://t.co/lZXt2gjzJ3 &gt; Revision In Service Charges wef 01.10.2019 for information on your concern. In case the charges applied are not in line with the schedule, you may register a complaint at (1/3)",0
111,1264843214126755842,tweet,2020-05-25 08:58:16,"@heeralaljoshi https://t.co/2AUlBhUCMM under General Banking// Charges Related category. We will look into the matter. Alternatively, you may also call on SBI's helpline number i.e. 1800 11 2211 (toll-free), 1800 425 3800 (toll-free) or 080-26599990 8am to 8pm to register your (2/3)",0
109,1264843095608197120,retweet,2020-05-25 08:57:48,Unlock the value of your gold and fulfill the financial needs for agricultural activities. Follow these 4 steps and avail Agricultural Gold Loan through YONO Krishi. Download now: https://t.co/UaI8IqyqlN  #SBIForFarmers #YONOKrishi #YONOSBI #SBI https://t.co/erlzs7lrI9,0
108,1264842643277860864,tweet,2020-05-25 08:56:00,"@kodesiashruti phone/email/SMS as it may lead to frauds. You may report such cases to your nearest SBI branch, our email id (epg.cms@sbi.co.in) &amp; to the law enforcement agencies operating in your area. https://t.co/mSYcXr4dBD (2/2)",0
107,1264842642220896256,tweet,2020-05-25 08:56:00,"@kodesiashruti Dear Shruti Kodesia, please note SBI or its employees will never seek sensitive information like user id, PIN, internet banking passwords, CVV No, OTP, etc., through phone/SMS/email. We request you to not divulge account related information to anyone over the (1/2)",0
106,1264842305560772608,tweet,2020-05-25 08:54:39,this snap filter ft my puffy eyes ✨  post ko daw sbi ni @binuluanryon https://t.co/LYXkuUenqK,0
105,1264842087586910208,retweet,2020-05-25 08:53:47,"Shopping and saving dono, with YONO! This Eid, go shopping on Flipkart via YONO SBI and get 5% additional cashback* up to ₹750 on using SBI debit/credit card. Download now: https://t.co/yjDSsj2O4L #YONOSBI https://t.co/V70NpxgzTc",0
104,1264842010902630401,tweet,2020-05-25 08:53:29,"At SBI Life we have pledged to contribute 10,000 PPE kits to the frontline heroes. We're counting on you to join our efforts and share your messages of support. We'll send your message and name along with the PPE kits we contribute through the initiative. https://t.co/eBlButo4Ud",0
103,1264842004174901249,retweet,2020-05-25 08:53:28,"Bipin Bihari Goudu ,State-Odisha having SBI Ac-30602697695 M-8117879240 has been hacked and Rs 15500 has been withdrawn from bank account through @PhonePe_.I request @PhonePeSupport @phonepe_safety @TheOfficialSBI to take necessary action to refund this amount. @RBI @FinMinIndia https://t.co/vSQKtDlBDT",0
102,1264841740705390593,tweet,2020-05-25 08:52:25,"Subscription prices revised from May 28, 2020.                                           Hurry! Subscribe now to beat the price rise. For more information click on the link https://t.co/QA0oWrr56t  #ias #iasprelims2020 #bankexams #sbi #sbiclerks #LearningSpaceDigital #QuizTime https://t.co/Kd6Mj11arv",0
101,1264841063627280385,retweet,2020-05-25 08:49:43,"Shopping and saving dono, with YONO! This Eid, go shopping on Flipkart via YONO SBI and get 5% additional cashback* up to ₹750 on using SBI debit/credit card. Download now: https://t.co/yjDSsj2O4L #YONOSBI https://t.co/V70NpxgzTc",0
